{
  "$schema": "https://json-schema.org/draft/2020-12/schema",
  "$id": "https://github.com/mbta/schemas/blob/main/schemas/com.mbta.ctd.glides.trips_updated.v1.json",
  "description": "Trips Updated",
  "type": "object",
  "properties": {
    "type": { "const": "com.mbta.ctd.glides.trips_updated.v1" },
    "specversion": { "const": "1.0" },
    "source": { "$ref": "glides-events.json#/properties/source" },
    "id": { "$ref": "glides-events.json#/properties/id" },
    "time": { "$ref": "glides-events.json#/$defs/timestamp" },
    "data": {
      "type": "object",
      "properties": {
        "metadata": { "$ref": "glides-events.json#/$defs/metadata" },
        "tripUpdates": {
          "type": "array",
          "items": {
            "anyOf": [
              { "$ref": "#/$defs/trip_updated" },
              { "$ref": "#/$defs/trip_added" }
            ]
          }
        }
      },
      "required": ["metadata", "tripUpdates"]
    }
  },
  "required": ["type", "specversion", "source", "id", "time", "data"],
  "$defs": {
    "car": {
      "type": "object",
      "properties": {
        "label": {
          "oneOf": [{ "const": "none" }, { "type": "string", "minLength": 1 }]
        },
        "operator": {
          "oneOf": [
            { "const": "none" },
            { "const": "unset" },
            { "$ref": "glides-events.json#/$defs/operator" }
          ]
        }
      }
    },
    "dropped_reason": {
      "type": "object",
      "properties": {
        "reason": { "type": "string" }
      },
      "required": ["reason"]
    },
    "scheduled": {
      "type": "object",
      "properties": {
        "scheduledCars": {
          "type": "array",
          "minItems": 1,
          "maxItems": 2,
          "items": { "$ref": "#/$defs/scheduled_car" }
        }
      },
      "required": ["scheduledCars"]
    },
    "scheduled_car": {
      "type": "object",
      "properties": {
        "run": { "type": "string", "minLength": 1, "pattern": "^[1-9][0-9]*$" },
        "operator": { "$ref": "glides-events.json#/$defs/operator" }
      }
    },
    "time": {
      "type": "string",
      "pattern": "^[012][0-9]:[0-5][0-9]:[0-6][0-9]$",
      "$comment": "HH:MM:SS, measured from 12hr before noon",
      "examples": ["04:30:00", "25:35:00"]
    },
    "trip_added": {
      "type": "object",
      "allOf": [
        { "$ref": "#/$defs/trip_updated" },
        {
          "properties": {
            "previousTripKey": { "$ref": "#/$defs/trip_key" },
            "type": { "const": "added" },
            "tripKey": {
              "$comment": "must use the added form of trip_key",
              "type": "object",
              "properties": { "glidesId": true },
              "required": ["glidesId"]
            }
          }
        },
        {
          "anyOf": [
            {
              "properties": { "startLocation": true },
              "required": ["startLocation"]
            },
            {
              "properties": { "endLocation": true },
              "required": ["endLocation"]
            }
          ]
        },
        {
          "anyOf": [
            { "properties": { "startTime": true }, "required": ["startTime"] },
            { "properties": { "endTime": true }, "required": ["endTime"] },
            {
              "properties": { "previousTripKey": true },
              "required": ["previousTripKey"]
            }
          ]
        },
        {
          "properties": {
            "revenue": {
              "$comment": "if revenue is missing when adding a trip, assume it's in revenue service. if revenue is missing when updating a trip, that means no change, so there is no default",
              "default": "revenue"
            }
          }
        }
      ]
    },
    "trip_key": {
      "type": "object",
      "properties": {
        "serviceDate": { "$ref": "glides-events.json#/$defs/service_date" }
      },
      "required": ["serviceDate"],
      "oneOf": [
        {
          "$comment": "added trip",
          "properties": {
            "glidesId": { "type": "string", "minLength": 1 }
          },
          "required": ["glidesId"]
        },
        {
          "$comment": "scheduled trip",
          "properties": {
            "tripId": { "type": "string", "minLength": 1 },
            "startLocation": { "$ref": "glides-events.json#/$defs/location" },
            "endLocation": { "$ref": "glides-events.json#/$defs/location" },
            "startTime": { "$ref": "#/$defs/time" },
            "endTime": { "$ref": "#/$defs/time" },
            "revenue": {
              "oneOf": [{ "const": "revenue" }, { "const": "nonrevenue" }],
              "default": "revenue"
            }
          },
          "required": ["startLocation", "endLocation", "startTime", "endTime"]
        }
      ]
    },
    "trip_updated": {
      "type": "object",
      "properties": {
        "type": {
          "oneOf": [{ "const": "updated" }, { "const": "added" }]
        },
        "tripKey": { "$ref": "#/$defs/trip_key" },
        "comment": { "type": "string" },
        "startLocation": {
          "oneOf": [
            { "$ref": "glides-events.json#/$defs/location" },
            { "const": "unset" }
          ]
        },
        "endLocation": {
          "oneOf": [
            { "$ref": "glides-events.json#/$defs/location" },
            { "const": "unset" }
          ]
        },
        "startTime": {
          "oneOf": [{ "$ref": "#/$defs/time" }, { "const": "unset" }]
        },
        "endTime": {
          "oneOf": [{ "$ref": "#/$defs/time" }, { "const": "unset" }]
        },
        "automaticStartTime": {
          "oneOf": [{ "$ref": "#/$defs/time" }, { "const": "unset" }]
        },
        "automaticEndTime": {
          "oneOf": [{ "$ref": "#/$defs/time" }, { "const": "unset" }]
        },
        "cars": {
          "type": "array",
          "minItems": 1,
          "maxItems": 2,
          "items": { "$ref": "#/$defs/car" }
        },
        "revenue": {
          "oneOf": [{ "const": "revenue" }, { "const": "nonrevenue" }]
        },
        "dropped": {
          "oneOf": [{ "$ref": "#/$defs/dropped_reason" }, { "const": false }]
        },
        "scheduled": {
          "oneOf": [{ "$ref": "#/$defs/scheduled" }, { "const": null }]
        }
      },
      "required": ["type", "tripKey", "scheduled"]
    }
  }
}
