[
  {
    "type": "com.mbta.ctd.glides.trips_updated.v1",
    "specversion": "1.0",
    "source": "glides.mbta.com",
    "id": "19fdb184-7dd6-4664-8472-04bd6177ec44",
    "time": "2023-01-20T09:30:00-05:00",
    "data": {
      "metadata": {
        "inputType": "dropped-trip",
        "uiVersion": "1"
      },
      "tripUpdates": [
        {
          "type": "updated",
          "tripKey": {
            "serviceDate": "2022-01-20",
            "tripId": "64101244",
            "startLocation": { "gtfsId": "place-lake" },
            "endLocation": { "gtfsId": "place-gover" },
            "startTime": "10:00:00",
            "endTime": "10:47:00"
          },
          "dropped": { "reason": "ran as single" },
          "scheduled": {
            "scheduledCars": [
              {
                "run": "506",
                "operator": { "badgeNumber": "678" }
              },
              {
                "run": "507",
                "operator": { "badgeNumber": "789" }
              }
            ]
          }
        }
      ]
    }
  },
  {
    "type": "com.mbta.ctd.glides.trips_updated.v1",
    "specversion": "1.0",
    "source": "glides.mbta.com",
    "id": "19fdb184-7dd6-4664-8472-04bd6177ec44",
    "time": "2023-01-20T09:30:00-05:00",
    "data": {
      "metadata": {
        "inputType": "edit-trip"
      },
      "tripUpdates": [
        {
          "type": "updated",
          "tripKey": {
            "serviceDate": "2022-01-20",
            "tripId": "64101243",
            "startLocation": { "gtfsId": "place-lake" },
            "endLocation": { "gtfsId": "place-gover" },
            "startTime": "09:55:00",
            "endTime": "10:42:00"
          },
          "comment": "single",
          "cars": [
            {
              "label": "3800",
              "operator": { "badgeNumber": "456" }
            }
          ],
          "scheduled": {
            "scheduledCars": [
              {
                "run": "504",
                "operator": { "badgeNumber": "456" }
              },
              {
                "run": "505",
                "operator": { "badgeNumber": "567" }
              }
            ]
          }
        }
      ]
    }
  },
  {
    "type": "com.mbta.ctd.glides.trips_updated.v1",
    "specversion": "1.0",
    "source": "glides.mbta.com",
    "id": "19fdb184-7dd6-4664-8472-04bd6177ec44",
    "time": "2023-01-20T09:30:00-05:00",
    "data": {
      "metadata": {
        "inputType": "add-trip"
      },
      "tripUpdates": [
        {
          "type": "added",
          "tripKey": {
            "serviceDate": "2022-01-20",
            "glidesId": "ADDED-1"
          },
          "startLocation": { "gtfsId": "place-lake" },
          "startTime": "10:00:00",
          "cars": [
            {
              "label": "3850",
              "operator": { "badgeNumber": "567" }
            }
          ],
          "scheduled": null
        },
        {
          "type": "added",
          "tripKey": {
            "serviceDate": "2022-01-20",
            "glidesId": "ADDED-2"
          },
          "endLocation": { "gtfsId": "place-lake" },
          "previousTripKey": {
            "serviceDate": "2022-01-20",
            "glidesId": "ADDED-1"
          },
          "cars": [
            {
              "label": "3850",
              "operator": { "badgeNumber": "567" }
            }
          ],
          "scheduled": null
        }
      ]
    }
  }
]
